<?xml version="1.0" encoding="UTF-8"?>
<course-collection xmlns:xsi="http://www.w3.org/2001/XMLSchema-instance"
 xsi:noNamespaceSchemaLocation="courses_data.xsd">
    <course-details>
        <rating>4.9</rating>
        <no-of-ratings>1240</no-of-ratings>
        <course>
            <title>Advanced React Design Systems</title>
            <description>Build professional-grade UI kits with Tailwind and TypeScript.</description>
            <id>0</id>
        </course>
        <tutor>
            <name>Sarah Drasner</name>
            <designation>Engineering Leader</designation>
            <experience>Specialist in SVG animations and scalable web architecture.</experience>
        </tutor>
        <curriculum>
            <chapter><number>1</number><title>Atomic Design Principles</title><description>Breaking UI into atoms and molecules.</description></chapter>
            <chapter><number>2</number><title>Tailwind Configuration</title><description>Setting up design tokens.</description></chapter>
            <chapter><number>3</number><title>Component API Design</title><description>Creating flexible props for reusable buttons.</description></chapter>
            <chapter><number>4</number><title>State Management</title><description>Using Headless UI for accessibility.</description></chapter>
            <chapter><number>5</number><title>Documentation</title><description>Deploying a living style guide.</description></chapter>
            <chapter><number>6</number><title>Testing Components</title><description>Unit testing with Vitest and RTL.</description></chapter>
        </curriculum>
        <price><old-price>2,999</old-price><new-price>499</new-price></price>
        <img-src>https://img-c.udemycdn.com/course/240x135/1362070_b9a1_2.jpg</img-src>
    </course-details>

    <course-details>
        <rating>4.8</rating>
        <no-of-ratings>850</no-of-ratings>
        <course>
            <title>Node.js Microservices Architecture</title>
            <description>Mastering distributed systems and Docker orchestration.</description>
            <id>1</id>
        </course>
        <tutor>
            <name>Stephen Grider</name>
            <designation>Full Stack Architect</designation>
            <experience>Expert in large-scale system design.</experience>
        </tutor>
        <curriculum>
            <chapter><number>1</number><title>Microservices Intro</title><description>Monolith vs Microservices.</description></chapter>
            <chapter><number>2</number><title>NATS JetStream</title><description>Event-based communication.</description></chapter>
            <chapter><number>3</number><title>Dockerizing Services</title><description>Multi-stage builds.</description></chapter>
            <chapter><number>4</number><title>Kubernetes Basics</title><description>Pods and Deployments.</description></chapter>
            <chapter><number>5</number><title>Auth Strategies</title><description>Centralized JWT handling.</description></chapter>
            <chapter><number>6</number><title>Error Handling</title><description>Dead Letter Queues.</description></chapter>
            <chapter><number>7</number><title>Service Discovery</title><description>How services find each other.</description></chapter>
            <chapter><number>8</number><title>Load Balancing</title><description>Ingress-Nginx configuration.</description></chapter>
            <chapter><number>9</number><title>Database Per Service</title><description>Data consistency patterns.</description></chapter>
        </curriculum>
        <price><old-price>4,500</old-price><new-price>699</new-price></price>
        <img-src>https://img-c.udemycdn.com/course/240x135/6743757_f56a_10.jpg</img-src>
    </course-details>

    <course-details>
        <rating>4.7</rating>
        <no-of-ratings>2100</no-of-ratings>
        <course>
            <title>Data Science for Real Estate</title>
            <description>Using Python to predict property prices.</description>
            <id>2</id>
        </course>
        <tutor>
            <name>Dr. Angela Yu</name>
            <designation>Lead Instructor</designation>
            <experience>Developer and Educator.</experience>
        </tutor>
        <curriculum>
            <chapter><number>1</number><title>Pandas Deep Dive</title><description>Cleaning datasets.</description></chapter>
            <chapter><number>2</number><title>Matplotlib Visuals</title><description>Creating heatmaps.</description></chapter>
            <chapter><number>3</number><title>Regression Analysis</title><description>Predictive models.</description></chapter>
            <chapter><number>4</number><title>Scikit-Learn</title><description>Tuning hyperparameters.</description></chapter>
            <chapter><number>5</number><title>Streamlit Dashboards</title><description>Interactive web apps.</description></chapter>
        </curriculum>
        <price><old-price>3,200</old-price><new-price>499</new-price></price>
        <img-src>https://img-c.udemycdn.com/course/240x135/6833239_16c7_2.jpg</img-src>
    </course-details>

    <course-details>
        <rating>4.9</rating>
        <no-of-ratings>430</no-of-ratings>
        <course>
            <title>Ethical Hacking: Network Security</title>
            <description>Identify and patch vulnerabilities.</description>
            <id>3</id>
        </course>
        <tutor>
            <name>Zaid Sabih</name>
            <designation>Security Researcher</designation>
            <experience>Professional penetration tester.</experience>
        </tutor>
        <curriculum>
            <chapter><number>1</number><title>Reconnaissance</title><description>Information gathering.</description></chapter>
            <chapter><number>2</number><title>Nmap Scanning</title><description>Network discovery.</description></chapter>
            <chapter><number>3</number><title>Metasploit Basics</title><description>Exploitation framework.</description></chapter>
            <chapter><number>4</number><title>Payload Delivery</title><description>Bypassing antivirus.</description></chapter>
            <chapter><number>5</number><title>Privilege Escalation</title><description>Becoming Root/Admin.</description></chapter>
            <chapter><number>6</number><title>Wireless Security</title><description>Cracking WPA3.</description></chapter>
            <chapter><number>7</number><title>MITM Attacks</title><description>Intercepting traffic.</description></chapter>
            <chapter><number>8</number><title>Final Lab</title><description>Full network penetration test.</description></chapter>
        </curriculum>
        <price><old-price>5,999</old-price><new-price>799</new-price></price>
        <img-src>https://img-c.udemycdn.com/course/240x135/6193991_b6f6.jpg</img-src>
    </course-details>

    <course-details>
        <rating>4.6</rating>
        <no-of-ratings>980</no-of-ratings>
        <course>
            <title>Flutter &amp; Firebase Masterclass</title>
            <description>Build full-stack mobile applications.</description>
            <id>4</id>
        </course>
        <tutor>
            <name>Max Schwarzmüller</name>
            <designation>Freelance Developer</designation>
            <experience>Mobile Dev Expert.</experience>
        </tutor>
        <curriculum>
            <chapter><number>1</number><title>Dart Intro</title><description>Async/Await basics.</description></chapter>
            <chapter><number>2</number><title>UI Widgets</title><description>Stateless vs Stateful.</description></chapter>
            <chapter><number>3</number><title>Navigation</title><description>Push/Pop and Named routes.</description></chapter>
            <chapter><number>4</number><title>Firebase Auth</title><description>Google &amp; Email login.</description></chapter>
            <chapter><number>5</number><title>Cloud Firestore</title><description>CRUD operations.</description></chapter>
            <chapter><number>6</number><title>Cloud Functions</title><description>Backend logic in JS.</description></chapter>
            <chapter><number>7</number><title>Push Notifications</title><description>FCM integration.</description></chapter>
        </curriculum>
        <price><old-price>3,500</old-price><new-price>550</new-price></price>
        <img-src>https://img-c.udemycdn.com/course/240x135/4237450_54d3_2.jpg</img-src>
    </course-details>

    <course-details>
        <rating>4.9</rating>
        <no-of-ratings>3200</no-of-ratings>
        <course>
            <title>Competitive Programming &amp; Graph Mastery</title>
            <description>The ultimate guide to acing coding interviews.</description>
            <id>5</id>
        </course>
        <tutor>
            <name>Striver</name>
            <designation>Software Engineer</designation>
            <experience>SDE at Top Tier Company.</experience>
        </tutor>
        <curriculum>
            <chapter><number>1</number><title>DFS/BFS</title><description>Graph traversals.</description></chapter>
            <chapter><number>2</number><title>Cycle Detection</title><description>Directed &amp; Undirected.</description></chapter>
            <chapter><number>3</number><title>Topological Sort</title><description>Kahn’s Algorithm.</description></chapter>
            <chapter><number>4</number><title>Dijkstra’s</title><description>Shortest path.</description></chapter>
            <chapter><number>5</number><title>Bellman-Ford</title><description>Negative edges.</description></chapter>
            <chapter><number>6</number><title>MST</title><description>Prims &amp; Kruskals.</description></chapter>
            <chapter><number>7</number><title>Disjoint Set</title><description>Union by Rank/Size.</description></chapter>
            <chapter><number>8</number><title>Bridges in Graph</title><description>Tarjan’s Algorithm.</description></chapter>